Job Position,Job Description,Date Created,Pooling Status,Job ID,Last Modified
Data Scanner,"Job Description
Scan and review digital and print media from home to collect relevant news content efficiently.
Upload scanned materials to the designated web dashboard and ensure proper categorization.
Crop and adjust articles for accuracy, clarity, and alignment with content standards before submission.
Maintain an organized workflow to ensure timely delivery of scanned and processed media.

Minimum Qualifications
No minimum educational background required; candidates from all academic levels are welcome.
Must be willing and able to work early morning shifts starting at 4:00 AM.
Open to applicants of all age groups who are responsible, reliable, and committed to accuracy in work",2025-12-01 02:16:19,Pooled,,
Product Designer,"Job Description
Gather and evaluate user requirements in collaboration with product managers and engineers
Illustrate design ideas using storyboards, process flows and sitemaps
Design graphic user interface elements, like menus, tabs, widgets, etc
Develop UI mockups and prototypes that clearly illustrate how the visual, interactions, and paths look like
Create original graphic designs (e.g. images, sketches and tables)
Prepare and present drafts to internal teams and key stakeholders
Identify and troubleshoot UX problems (e.g. responsiveness)
Conduct usability testing and product/feature adjustments based on user feedback
Minimum Qualifications
1-2 years work experience as a Product/UX Designer or similar role
Knowledgeable in using genAI tools (e.g. chatGPT, midjourney, etc.) or video editing tools (e.g. canva, CapCut, Adoble After Effects) is a MUST
Mastery of human-centered design
Mastery of interaction design skills and attention to detail
Excellent with logical and data approach to communicate design details
Experience using Figma and design software like Adobe Illustrator and Photoshop
Experience developing dashboard-type products
Team spirit; strong communication skills to collaborate with various stakeholders
Good time-management skills
Basic in Design, Computer Science or relevant field
Have skill on creative & motion graphic is a plus value",2025-12-02 03:03:44,Pooled,,
Content Writer Money,"Job Description
Writing news related to economic trends and/or issues.
Developing news angle based on SEO keywords.
Interviewing news sources if necessary.
Coordinating with editor and other editorial team.
Able to do self-editing news to CMS.
Minimum Qualifications
Having 5 years experience as journalist at online media
Collect, analyze, translate economy articles
Familiar with economy issues
Have the ability to work under pressure
Fluently in English, especially in reading and writing",2025-12-08 04:43:46,Pooled,,
Reporter Megapolitan,"Passionate to be a journalist and creative.
Able to write and work on team.
Able to work under tight deadlines.
Candidate must have at least bachelor degree in any major from reputable university, preferably public university.
Having min. 1 year experience as a journalist.
Wiling to be assigned at any area in Jabodetabek.",2025-12-12 09:44:56,Pooled,,
Reporter Nasional,"- berpengalaman liputan lapangan, wawancara dan menulis berita untuk isu politik, hukum, nasional.
- berpengalaman maksimal 2 tahun sebagai reporter media online.
- dapat mengambil foto dan video liputan, serta editing foto/video sederhana.
- latar belakang pendidikan jurnalistik, ilmu komunikasi, atau sastra.",2025-12-16 09:41:53,Pooled,,
Freelance Reporter Olahrga,"Job Description:
Cover and report on various sports events, including matches, tournaments, press conferences, and related activities.
Gather, verify, and analyze information from reliable sources such as athletes, coaches, officials, and stakeholders.
Write accurate, engaging, and timely sports news articles in accordance with journalistic standards and editorial guidelines.
Conduct interviews and produce insightful and relevant content.
Monitor and follow current sports news, trends, and developments at local, national, and international levels.
Coordinate with editors to plan coverage and meet publication deadlines.
Adhere to journalistic ethics and newsroom policies.
Perform field and desk reporting as required.

Qualifications:
Bachelor’s degree in Journalism, Communication, or a related field is preferred.
Strong interest and knowledge in sports.
Excellent writing and storytelling skills in English.
Strong communication and interviewing abilities.
Ability to work under tight deadlines and flexible working hours, including evenings and weekends.
Able to work independently and collaboratively within a team.
Prior experience as a reporter or journalist is a plus.",2025-12-22 03:52:47,Pooled,,
Software Engineer,"Bachelor degree in technical majors is preferred (e.g. Computer Science, Information Technology, Data Science or other related majors.)
Experienced in web development frameworks such as CodeIgniter and Laravel (with additional advantages in Next.js, Vue, and Django).
Passion in software engineering and big data systems
Proficient in PHP, JavaScript, and Python (as an additional skill).
Strong understanding of modular concepts.
Familiarity and have hands-on experience with Cloud Computing, such as AWS/GCP
Skilled in utilizing Docker as a development environment.
Proficient in using version control systems (Git).
Capable of leveraging AI tools to support tasks and develop automation.
Able to work effectively in a team and communicate clearly.",2026-01-08 02:54:50,Pooled,,
